{
  "schema_version": 1,
  "packet_mode": "ready_for_dispatch",
  "task_id": "UI-2026-10-09",
  "queue_file": "BUILD_QUEUE.json",
  "requirement_ids": [
    "C05",
    "C01",
    "M01"
  ],
  "goal": "Deliver the 16 exact reviewed UI/context and existing document-release source files to the existing OS Lovable project, then return actual source hashes, build and operation evidence.",
  "original_intent": "Delivery phase of existing UI-2026-10-09 and DOC-001D-UI; reuses accepted UI-2026-10-10-CONTEXT. No new live task, app, service, role, approval or queue.",
  "input": {
    "repository": "https://github.com/AuxiliumEnvironmental/auxiliumos.git",
    "commit": "a54372cbb40b6c7ef1044f1932aabb997670f585",
    "tree": "a4fc2c8a7b5d4b3b6660924177cab110c1b36310",
    "working_tree_requirement": "No repository edits. Existing OS provider must still be at pinned 8d59d222 with terminal prior operation and no active writer. Compare every original destination hash or expected absence before any replacement; stop on unexpected state.",
    "controlling_sources": [
      {
        "path": "web/src/components/document-version-release.tsx",
        "revision": "a54372cbb40b6c7ef1044f1932aabb997670f585",
        "sha256": "c21343aa7b5197e702f30c3c8e36b20acfb58550eb99341923556dbadd8ebf6a",
        "purpose": "Exact reviewed output bytes for provider delivery; original destination hash/absence in HOST_DELIVERY_MANIFEST.json"
      },
      {
        "path": "web/src/components/document-version-review.tsx",
        "revision": "a54372cbb40b6c7ef1044f1932aabb997670f585",
        "sha256": "d98f928e4eabe5fcbacc593d88330dd641597b34195ac9fe081abae08143863f",
        "purpose": "Exact reviewed output bytes for provider delivery; original destination hash/absence in HOST_DELIVERY_MANIFEST.json"
      },
      {
        "path": "web/src/components/document-versions.tsx",
        "revision": "a54372cbb40b6c7ef1044f1932aabb997670f585",
        "sha256": "d9d46c1cf2a66fb3b6ef03fde1a32cfe935dfb3fe1c82695042132440edda50b",
        "purpose": "Exact reviewed output bytes for provider delivery; original destination hash/absence in HOST_DELIVERY_MANIFEST.json"
      },
      {
        "path": "web/src/components/module-draft-screen.tsx",
        "revision": "a54372cbb40b6c7ef1044f1932aabb997670f585",
        "sha256": "b33a0bcc274808566dca084247933e698dd8bd25a6462536d5928d6b2bf4c2e7",
        "purpose": "Exact reviewed output bytes for provider delivery; original destination hash/absence in HOST_DELIVERY_MANIFEST.json"
      },
      {
        "path": "web/src/components/plan-context.tsx",
        "revision": "a54372cbb40b6c7ef1044f1932aabb997670f585",
        "sha256": "4498a07d2e2c67da943a2b7cd72440bb893fccb2ce58ba655a20d5b18b5d0e60",
        "purpose": "Exact reviewed output bytes for provider delivery; original destination hash/absence in HOST_DELIVERY_MANIFEST.json"
      },
      {
        "path": "web/src/lib/directory-api.ts",
        "revision": "a54372cbb40b6c7ef1044f1932aabb997670f585",
        "sha256": "b63a9f49c0faee99c976fcad879875482132a27974a81a195fbc93667b6e9077",
        "purpose": "Exact reviewed output bytes for provider delivery; original destination hash/absence in HOST_DELIVERY_MANIFEST.json"
      },
      {
        "path": "web/src/lib/document-release-api.ts",
        "revision": "a54372cbb40b6c7ef1044f1932aabb997670f585",
        "sha256": "f59062748433932227e8bb47541dec9c0bd5b11eed38cf91c3ca1086945dfacc",
        "purpose": "Exact reviewed output bytes for provider delivery; original destination hash/absence in HOST_DELIVERY_MANIFEST.json"
      },
      {
        "path": "web/src/lib/runtime.tsx",
        "revision": "a54372cbb40b6c7ef1044f1932aabb997670f585",
        "sha256": "dd788f18df7c2d7ac3d7e0f391a72b5a97fa8548d8778ce0b779c8f986df4187",
        "purpose": "Exact reviewed output bytes for provider delivery; original destination hash/absence in HOST_DELIVERY_MANIFEST.json"
      },
      {
        "path": "web/src/lib/use-directory.ts",
        "revision": "a54372cbb40b6c7ef1044f1932aabb997670f585",
        "sha256": "dca51b487dc7e9ed8321d3b4659c26a39500949152a90135300c34462a4daf22",
        "purpose": "Exact reviewed output bytes for provider delivery; original destination hash/absence in HOST_DELIVERY_MANIFEST.json"
      },
      {
        "path": "web/src/lib/use-draft-transition.ts",
        "revision": "a54372cbb40b6c7ef1044f1932aabb997670f585",
        "sha256": "4f8948a640ad51e0ff7ed6e416dcaaf25ca2944e47dafcac2c8d027345bc3903",
        "purpose": "Exact reviewed output bytes for provider delivery; original destination hash/absence in HOST_DELIVERY_MANIFEST.json"
      },
      {
        "path": "web/src/lib/use-planning-context.ts",
        "revision": "a54372cbb40b6c7ef1044f1932aabb997670f585",
        "sha256": "8bc5bba4b095db60919959bfefbaf2fce7f08e7f4785e186e11b82943aaf3209",
        "purpose": "Exact reviewed output bytes for provider delivery; original destination hash/absence in HOST_DELIVERY_MANIFEST.json"
      },
      {
        "path": "web/src/lib/use-workspace-plans.ts",
        "revision": "a54372cbb40b6c7ef1044f1932aabb997670f585",
        "sha256": "2d121cb6f399cb02fc31987a1f4f8f3c4faf49074b93df51873f7adc30275b24",
        "purpose": "Exact reviewed output bytes for provider delivery; original destination hash/absence in HOST_DELIVERY_MANIFEST.json"
      },
      {
        "path": "web/src/pages/directory.tsx",
        "revision": "a54372cbb40b6c7ef1044f1932aabb997670f585",
        "sha256": "e6587fd4a1fded9c7a2c202429dd38412185e0757935a06756b15acf8a654081",
        "purpose": "Exact reviewed output bytes for provider delivery; original destination hash/absence in HOST_DELIVERY_MANIFEST.json"
      },
      {
        "path": "web/src/pages/module-workspace.tsx",
        "revision": "a54372cbb40b6c7ef1044f1932aabb997670f585",
        "sha256": "84dac7c72128c078a6a3c4cffb151dfb120268f3322233f1dc0386322ce208b2",
        "purpose": "Exact reviewed output bytes for provider delivery; original destination hash/absence in HOST_DELIVERY_MANIFEST.json"
      },
      {
        "path": "web/src/pages/private-files.tsx",
        "revision": "a54372cbb40b6c7ef1044f1932aabb997670f585",
        "sha256": "a4f868fe164b081b10de23db03a66e42c8923adaa24c616b38e77f59ff6d7613",
        "purpose": "Exact reviewed output bytes for provider delivery; original destination hash/absence in HOST_DELIVERY_MANIFEST.json"
      },
      {
        "path": "web/src/router.tsx",
        "revision": "a54372cbb40b6c7ef1044f1932aabb997670f585",
        "sha256": "279eb1cf3dcef44a7cc6ec61d02d8f2b0c033d690655f9ef543231655c066620",
        "purpose": "Exact reviewed output bytes for provider delivery; original destination hash/absence in HOST_DELIVERY_MANIFEST.json"
      }
    ],
    "external_surfaces": [
      {
        "name": "lovable",
        "identifier": "0b7bbfc6-627f-4ca0-9217-98f5b164b419",
        "observed_revision": "8d59d22271287d7e1185fc3a65b1cfd548c4e82a",
        "observation": "Existing OS host completed.12existing destination files inspected and four expected new files confirmed absent. All divergent document source is older than canonical; no competing edit accepted.",
        "write_policy": "assigned_writer"
      },
      {
        "name": "spatial",
        "identifier": "addeb89f-cdf1-4688-9157-b208793ffb8e",
        "observed_revision": "c160e74dc192d03605eafc8611e4c2e4917394d7",
        "observation": "Separate lead operation completed; no allocation is reclaimed and no source/selector/adapter/generated file is included.",
        "write_policy": "none"
      }
    ]
  },
  "ownership": {
    "integrator": "integration-lead",
    "worker_role": "release-engineer",
    "worker_id": "existing-os-lovable-agent",
    "branch": "provider-project-at-8d59d22271287d7e1185fc3a65b1cfd548c4e82a",
    "isolation_mode": "exclusive_files",
    "worktree_path": null,
    "allowed_paths": [
      "web/src/components/document-version-release.tsx",
      "web/src/components/document-version-review.tsx",
      "web/src/components/document-versions.tsx",
      "web/src/components/module-draft-screen.tsx",
      "web/src/components/plan-context.tsx",
      "web/src/lib/directory-api.ts",
      "web/src/lib/document-release-api.ts",
      "web/src/lib/runtime.tsx",
      "web/src/lib/use-directory.ts",
      "web/src/lib/use-draft-transition.ts",
      "web/src/lib/use-planning-context.ts",
      "web/src/lib/use-workspace-plans.ts",
      "web/src/pages/directory.tsx",
      "web/src/pages/module-workspace.tsx",
      "web/src/pages/private-files.tsx",
      "web/src/router.tsx"
    ],
    "forbidden_shared_paths": [
      "All other destination files",
      "Spatial source, generated files, selectors and adapter",
      "Supabase",
      "package.json",
      "package-lock.json",
      "bun.lock",
      "web/src/styles.css",
      "Provider Auth/Cloud/MCP/permission settings",
      "DNS/publish settings",
      "Repository root masters"
    ],
    "allocation_check": "node scripts/os-control.mjs allocation TASK PATHS_FILE",
    "other_writer_check": "Source workers have returned and stopped; source hashes independently reviewed. Existing OS provider turn terminal and exact target pinned. Serialize this one provider write; no standalone Spatial writes."
  },
  "dependencies": [
    {
      "task_id": "UI-2026-10-10-CONTEXT",
      "required_contract": "Accepted Auth subject/profile, current-generation directory and planning-action recovery; frozen exact retries. IF-01/02/04/18.",
      "observed_source": "a54372cbb40b6c7ef1044f1932aabb997670f585",
      "verification_limit": "Candidate a54372 CI 38024351341 passed before dispatch; source/fixture acceptance only."
    },
    {
      "task_id": "DOC-001D-UI",
      "required_contract": "Exact immutable version review, separate release authority, explicit audience and narrowing withdrawal from accepted43d1ea48 source. No released-byte download UI claim.",